Name,Slug,Collection ID,Item ID,Archived,Draft,Created On,Updated On,Published On,Main Nav,Icon,Meta Title,Meta Description,Headline Main,Byline,Excerpt,Featured Image,Image Content Main,Content Main,Image 1,Content 1,Image 2,Content 2,Image 3,Content 3,Image Content Secondary,Content Secondary,Team Members,Areas,Headline 1,Technologies,Articles,Answers,DEP - Resources content,DEP - Headline 2,DEP - Headline 3,DEP - Headline 4,Process Step 1,Process Step 2,Process Step 3,Process Step 4
International SEO,international-seo,65c582990a5cea88721bd229,6839c57b4aeef5da4b10b988,false,false,Fri May 30 2025 14:49:31 GMT+0000 (Coordinated Universal Time),Fri May 30 2025 14:49:31 GMT+0000 (Coordinated Universal Time),Fri May 30 2025 14:49:31 GMT+0000 (Coordinated Universal Time),false,,International SEO: Expand Your Global Reach | Magnet,Unlock more global traffic in 90 days with our technical International SEO expertise. Proper implementation beats content translation for faster ROI.,Expand your global reach without expanding your team. 40% more global traffic in 90 days with your existing content,Analytics - SEO - Geographic Targeting,"<p id="""">International visibility isn't about translation volume, it's about technical implementation. While most companies focus exclusively on content, they're missing the foundation that actually drives results.</p>",,,"<h2 id="""">The global traffic gap is widening</h2><p id="""">In global markets, you don't need to be everywhere—you just need to be found everywhere.</p><p id="""">International visibility isn't about translation volume—it's about technical implementation. While most companies focus exclusively on content, they're missing the foundation that actually drives results. Google's 2025 algorithm updates have made proper international technical implementation <a href=""https://searchengineland.com/international-seo-everything-you-need-to-know-450866"" id="""">twice as important</a> as content translation alone.</p>",,"<h3 id="""">Technical implementation failures cost visibility</h3><p id=""""><a href=""https://ahrefs.com/blog/hreflang-study/"" id="""">Over 67%</a> of domains using hreflang have implementation issues, preventing proper international targeting and costing businesses significant global visibility.</p>",,"<h3 id="""">Content translation isn't enough</h3><p id="""">Websites with structured data are <a href=""https://www.pageoptimizer.pro/blog/technical-seo-statistics-that-you-must-know-in-2025"" id="""">58% more likely</a> to earn rich snippets in search results, yet most international sites lack proper schema implementation for multilingual content.</p>",,"<h3 id="""">First-mover advantage is real</h3><p id="""">Companies that implement proper international technical SEO see 3x higher ROI than translation-only approaches, creating a widening gap between leaders and followers in global markets.</p>",,"<h2 id="""">Technical excellence that drives global results</h2><p id="""">Magnet's International SEO expertise goes beyond basic multilingual implementation. We've developed a technical approach that addresses the most critical issues in international visibility. According to a study by Search Engine Land, <a href=""https://searchengineland.com/study-31-of-international-websites-contain-hreflang-errors-395161"" id="""">31% of international websites</a> contain conflicting hreflang directives, a critical error we specifically address in our implementation process.</p><p id="""">Our process integrates International SEO expertise into both SEO retainers and web development projects.</p>",,,,,,,,,,,"<h3 id="""">Discovery &amp; strategy</h3><p id=""""><strong id=""""><em id="""">We find the gaps your competitors miss.</em></strong> Our comprehensive analysis identifies international-specific issues costing you traffic. We analyze server response codes, evaluate hreflang implementation, and map content gaps against global search demand.</p>","<h3 id="""">Technical implementation</h3><p id=""""><strong id=""""><em id="""">Precision execution that search engines understand.</em></strong> Our development team implements the technical architecture required for international success, including server configuration for proper geo-targeting, hreflang tag implementation, and structured data optimization for multilingual content.</p>","<h3 id="""">Localization &amp; optimization</h3><p id=""""><strong id=""""><em id="""">Cultural relevance drives engagement and growth.</em></strong> With the technical foundation in place, we guide content localization efforts to maximize impact. Our market-specific keyword research identifies unique search behaviors in each target region, while our cultural adaptation ensures content resonates with local audiences.</p>",
Jamstack Development,jamstack,65c582990a5cea88721bd229,65c582990a5cea88721bd348,false,false,Tue Feb 14 2023 17:25:44 GMT+0000 (Coordinated Universal Time),Mon Dec 16 2024 23:10:39 GMT+0000 (Coordinated Universal Time),Tue May 13 2025 13:18:25 GMT+0000 (Coordinated Universal Time),false,https://cdn.prod.website-files.com/6392268cd1a3bc5df594bfa5/65e237816ee7e5acd115c592_BracketsCurly.svg,Advanced Jamstack Development for Web Solutions | Magnet,"Magnet excels in Jamstack development, offering websites that are fast, secure, and scalable, with headless CMS integration for enhanced user experience.",Pioneering the Future of Web Development with Jamstack,Secure - Performant - Scalable,"<p id="""">Magnet leverages Jamstack principles for modern web development, focusing on performance optimization and static site generation for faster, more secure websites.</p>",https://cdn.prod.website-files.com/6392268cd1a3bc5df594bfa5/65566c37d935d51b12a71709_software3.jpg,,"<h1 id="""">What is Jamstack?</h1><p id="""">Jamstack is an innovative web development architecture that stands for JavaScript, APIs, and Markup. It is a modern approach to web development that focuses on pre-rendering static pages and content, leveraging client-side JavaScript and APIs to create dynamic interactions. The Jamstack architecture offers several advantages over traditional web development methods, including improved performance, enhanced security, and simplified deployment and scaling processes.</p><h2 id="""">What are the core features of Jamstack?</h2><ol id=""""><li id="""">Pre-rendered Static Pages: Jamstack sites generate static pages during the build process, which can be easily cached and delivered through Content Delivery Networks (CDNs) for faster performance.</li><li id="""">Decoupled Architecture: Jamstack promotes a decoupled architecture, separating the front-end from the back-end through APIs. This allows developers to work independently on different parts of a project, improving the development process.</li><li id="""">Client-side JavaScript: Jamstack relies on client-side JavaScript to handle dynamic functionality and user interactions, reducing the need for server-side processing and improving overall site performance.</li><li id="""">API-driven Development: Jamstack sites leverage APIs to connect with various services and data sources, providing greater flexibility and modularity in web development projects.</li></ol><h2 id="""">How can Jamstack help your website?</h2><ol id=""""><li id="""">Faster Performance: By pre-rendering static pages and leveraging CDNs, Jamstack sites offer faster page load times, providing a better user experience and potentially improving search engine rankings.</li><li id="""">Enhanced Security: With the decoupled architecture, Jamstack reduces the attack surface by minimizing server-side code and database interactions, resulting in a more secure web application.</li><li id="""">Simplified Deployment and Scaling: Jamstack sites are easily deployed and scaled using static site hosting services and CDNs, reducing the complexity and cost associated with traditional web hosting.</li><li id="""">Improved Developer Experience: The decoupled and modular nature of Jamstack architecture allows developers to work on different parts of a project independently, using their preferred tools and frameworks, ultimately leading to a more efficient development process.</li></ol><h2 id="""">Popular alternatives to Jamstack</h2><ol id=""""><li id="""">Traditional Server-Side Rendering (SSR): Websites built using server-side technologies such as PHP, Ruby on Rails, or Python Django render pages on the server, which can result in slower performance and increased security vulnerabilities.</li><li id="""">Single Page Applications (SPAs): Web applications built using client-side JavaScript frameworks like React, Angular, or Vue.js without pre-rendering static content can suffer from slower initial load times and potentially lower search engine visibility.</li></ol><h2 id="""">Pros and Cons of Jamstack versus the main alternatives</h2><h3 id="""">Pros:</h3><ul id=""""><li id="""">Improved performance through static content and CDN delivery.</li><li id="""">Enhanced security due to the decoupled architecture and minimized server-side processing.</li><li id="""">Simplified deployment and scaling processes, resulting in cost savings.</li><li id="""">Better developer experience, allowing for greater flexibility and efficiency.</li></ul><h3 id="""">Cons:</h3><ul id=""""><li id="""">Potential limitations in dynamic functionality compared to traditional server-side rendering approaches.</li><li id="""">The need for developers to learn and adopt new tools and workflows associated with the Jamstack ecosystem.</li></ul>",https://cdn.prod.website-files.com/6392268cd1a3bc5df594bfa5/65566c37d935d51b12a71709_software3.jpg,,,,,,,,gavin-hall; alex-topal; andrew-gaynor; mike-heggie,Engineering,,stripe; sendgrid; sanity; nuxt-js; next-js,,,"<h4 id=""""><strong id="""">Books on Jamstack Development</strong></h4><h5 id=""""><a href=""https://www.amazon.com/Modern-Web-Applications-Next-JS-Techniques/dp/938859097X?crid=3Q64GMGMRZN6A&dib=eyJ2IjoiMSJ9.K7hfTUflOlekdUHxnswZPUoSTNKbzFjLBsXvbuG1AqYxKbIoJ0Vlom2AFKKBZ-AkuaBMGdFPPSnrgHKsBEDEck_wnDdWBKZRdxF_ENAjCjHGTCM_eRkXeEgQJHiGUptCTGXuYifDrSH_hGNIiucf7vuhskDdg-MAV_qyN51QhwsmrResLf9I-icTrBcGkzipRrVFGjqZYm_33dAF8F6tVDXZVNPmKHRcEdx0ivJnKVY.HRogrpRBgNoa6pIcBnWYj1TirY3_9sUw8qo5A3rCg78&dib_tag=se&keywords=next+js&qid=1708096434&sprefix=next+js%2Caps%2C185&sr=8-1&linkCode=ll1&tag=magnet005-20&linkId=29715c242f87e8276055bbfd8fe0f188&language=en_US&ref_=as_li_ss_tl""><strong id="""">Modern Web Applications with Next.JS: Learn Advanced Techniques to Build and Deploy Modern, Scalable and Production Ready React Applications with Next.JS</strong></a></h5><p id="""">Written by industry experts, this book delves into modern web development practices, focusing on how Jamstack can improve performance, security, and scalability.</p><h5 id=""""><a href=""https://www.amazon.com/Jamstack-Book-Beyond-static-JavaScript/dp/1617298883?crid=3BC0NO7HMZH6L&dib=eyJ2IjoiMSJ9.H8KI0O8AXMqSsUghCFNSGPLAkx81uz9x3oiCswRkEbpV7vmzTjGcmF2VpEioV61d-arxDWCJLguR7aHjn6sUX9OBXmVnIfwCpHn0-GhRpShpNlc3nZQlgQzZor_aVe1iNBgToAG06lZtAcT1aBpsX02csqW1N_tcy78MYaqNYgc-UKcMsBXSt1m3_YN3J5yavlA6v4Coqb2JjPXTKCJEjRXMnp3_LX0wCl7anT7iroJY-wY9ou4iHsRb_4nYkz2iUhhszMJWs-75LZRMbyL0EzvvZyDujCBm9biciQoKV6I.R6BC-AkD-qpIEfxs8anaVt4I0zGYCmkZZogB-mTWwH8&dib_tag=se&keywords=Jamstack&qid=1708096375&sprefix=jamstack%2Caps%2C136&sr=8-1&linkCode=ll1&tag=magnet005-20&linkId=3cf63e36eacf002460fca8859ac3e042&language=en_US&ref_=as_li_ss_tl""><strong id="""">The Jamstack Book: Beyond static sites with JavaScript, APIs, and markup</strong></a></h5><p id="""">Offers insights into building websites with Jamstack, including detailed examples and best practices for leveraging headless CMS and APIs for dynamic, scalable sites.</p><h4 id=""""><strong id="""">Online Resources</strong></h4><h5 id=""""><a href=""https://jamstack.org/""><strong id="""">Jamstack.org</strong></a></h5><p id="""">The official Jamstack site provides a comprehensive introduction, best practices, and showcases of Jamstack projects. It's the starting point for understanding the principles and advantages of Jamstack development.</p><h5 id=""""><a href=""https://jamstackconf.com/"" id=""""><strong id="""">Jamstack Conferences</strong></a></h5><p id="""">Conferences focusing on the latest in Jamstack development and technologies</p><h5 id=""""><a href=""https://docs.netlify.com/"" id=""""><strong id="""">Netlify Docs</strong></a></h5><p id="""">Netlify is a key platform for deploying Jamstack sites, offering serverless functions, continuous deployment, and more. Their documentation covers everything from basic deployment to advanced features like split testing and edge handlers.</p><h5 id=""""><a href=""https://vercel.com/docs"" id=""""><strong id="""">Vercel Documentation</strong></a></h5><p id="""">Similar to Netlify, Vercel is another platform for deploying Jamstack and serverless applications, with a focus on Next.js. Their documentation is an excellent resource for learning about deploying and optimizing Jamstack applications.</p><h5 id=""""><a href=""https://egghead.io/q?q=jamstack"" id=""""><strong id="""">Egghead.io Jamstack Courses</strong></a></h5><p id="""">Egghead offers concise video tutorials on various Jamstack topics, from static site generators like Gatsby and Eleventy to using headless CMSs and serverless functions.</p><h5 id=""""><a href=""https://www.freecodecamp.org/news/what-is-the-jamstack-and-how-do-i-host-my-website-on-it/"" id=""""><strong id="""">FreeCodeCamp</strong></a></h5><p id="""">Provides comprehensive tutorials and projects on web development, including Jamstack technologies. Their YouTube channel also has video tutorials covering Jamstack projects.</p><h5 id=""""><a href=""https://www.smashingmagazine.com/search/?q=jamstack"" id=""""><strong id="""">Smashing Magazine Articles on Jamstack</strong></a></h5><p id="""">Smashing Magazine frequently publishes articles and tutorials on Jamstack development, offering insights into best practices, tools, and workflows.</p><h5 id=""""><a href=""https://nextjs.org/docs"" id=""""><strong id="""">Next.js Documentation</strong></a></h5><p id="""">Next.js supports static site generation and server-side rendering, making it a powerful tool for Jamstack development. Their documentation covers everything from setup to advanced features like API routes.</p><h5 id=""""><a href=""https://nuxt.com/docs/getting-started/introduction"" id=""""><strong id="""">Nuxt.js Documentation</strong></a></h5><p id="""">For Vue.js developers, Nuxt.js offers a framework for creating static and server-rendered applications, with extensive documentation on best practices and optimization techniques.</p><h5 id=""""><a href=""https://www.sanity.io/"" id=""""><strong id="""">Sanity</strong></a><strong id="""">, </strong><a href=""https://www.contentful.com/"" id=""""><strong id="""">Contentful</strong></a><strong id="""">, and </strong><a href=""https://strapi.io/"" id=""""><strong id="""">Strapi</strong></a></h5><p id="""">These headless CMS platforms offer rich documentation on integrating content management into Jamstack projects, providing dynamic content capabilities without sacrificing performance.</p>",,,,,,,
Local SEO,local-seo,65c582990a5cea88721bd229,65e277bdef978d02630fff7b,false,false,Sat Mar 02 2024 00:50:05 GMT+0000 (Coordinated Universal Time),Fri May 30 2025 14:16:44 GMT+0000 (Coordinated Universal Time),Fri May 30 2025 14:16:44 GMT+0000 (Coordinated Universal Time),true,https://cdn.prod.website-files.com/6392268cd1a3bc5df594bfa5/65e277bcef978d02630ffeb1_LocalSEO.svg,Local SEO Services: Boost Local Visibility | Magnet,"Maximize your local presence with Magnet Web Agency's Local SEO services. From Google My Business optimization to local keyword targeting, we help your business dominate local search results.",Transform nearby searches into paying customers while your competitors remain invisible,Local Visibility - Google Business Profile - Local Listings,"<p id="""">Our comprehensive local SEO services enhance your visibility in geographic-specific searches through strategic Google Business Profile optimization, citation management, and reputation building to drive qualified local traffic to your business.</p>",https://cdn.prod.website-files.com/6392268cd1a3bc5df594bfa5/65e279c178180fa3aa3654fd_henry-perks-BJXAxQ1L7dI-unsplash.jpg,,"<h2 id="""">The invisible opportunity hiding in plain sight</h2><p id="""">The business that shows up wins. Period. <a href=""https://backlinko.com/local-seo-stats"" id="""">46%</a> of all Google searches have local intent, creating a massive opportunity most companies miss while chasing vanity metrics. Our data from managing over 200 local business websites shows that proper Local SEO implementation consistently delivers 3-5x ROI compared to traditional digital marketing tactics.</p><p id="""">‍</p>",https://cdn.prod.website-files.com/6392268cd1a3bc5df594bfa5/65e279c178180fa3aa3654fd_henry-perks-BJXAxQ1L7dI-unsplash.jpg,"<h3 id="""">Location visibility trumps brand recognition</h3><p id="""">In the mobile-first economy, being found matters more than being known. <a href=""https://backlinko.com/local-seo-stats"" id="""">88%</a> of consumers who search on a smartphone visit a related store within a week, making local search visibility your most direct path to new customers.</p>",,"<h3 id="""">Google rewards community over keywords</h3><p id=""""><a href=""https://www.forbes.com/councils/forbesbusinesscouncil/2025/03/21/the-2025-local-seo-shift-seven-simple-changes-every-business-can-make/"" id="""">Google's algorithm</a> prioritizes genuine local relevance over traditional SEO signals. Businesses demonstrating community integration see <a href=""https://www.seo.com/blog/local-seo-statistics/"" id="""">70%</a> higher conversion rates than those relying on outdated tactics.</p>",,"<h3 id="""">Technical precision creates unfair advantages</h3><p id="""">While competitors struggle with basic listings, our clients leverage structured data and hyperlocal targeting to capture the <a href=""https://backlinko.com/local-seo-stats"" id="""">customers</a> who are 2.7x more likely to consider a business reputable when it has a complete Google Business Profile.</p>",,"<h2 id="""">Why most Local SEO efforts fail (and how we're different)</h2><p id="""">Most agencies still approach Local SEO with outdated tactics from 2020. Our technical expertise goes beyond basic optimization, focusing on the signals Google actually rewards in 2025: community integration, hyperlocal relevance, and structured data implementation that makes your business information crystal clear to search engines.</p>",reisto-belovich; sarah-littlefield; katie-zeek,Marketing,,google-analytics; semrush; ubersuggest; google-search-console; ahrefs; google-ads; google-lighthouse; screaming-frog; moz-pro,how-local-seo-can-boost-your-revenue,can-you-help-with-search-engine-optimization-seo; how-does-a-custom-seo-agency-ensure-its-strategies-align-with-a-clients-brand; how-does-a-custom-seo-agency-identify-a-clients-unique-seo-needs; how-does-a-custom-seo-agency-measure-the-success-of-its-strategies; what-tools-and-technologies-are-commonly-used-by-custom-seo-agencies; what-types-of-businesses-typically-need-a-custom-seo-agency; what-are-the-core-services-offered-by-a-custom-seo-agency; what-are-the-steps-involved-in-developing-a-custom-seo-strategy,,,,,"<h3 id=""""><strong id="""">Discovery &amp; audit</strong></h3><p id="""">We analyze your local search footprint, identifying exactly where you're missing high-intent traffic through comprehensive Google Business Profile audits, citation accuracy checks, and competitor positioning analysis.</p>","<h3 id=""""><strong id="""">Strategy &amp; optimization</strong></h3><p id="""">Our team restructures your local presence to match what Google rewards in 2025, focusing on community integration, structured data implementation, and review generation that speaks directly to your ideal customers.</p>","<h3 id=""""><strong id="""">Implementation &amp; growth</strong></h3><p id="""">We execute the technical infrastructure necessary for local search dominance, including advanced schema markup, citation building, and Google Business Profile optimization that transforms your digital presence into a customer acquisition machine.</p>",
Mobile SEO,mobile-seo,65c582990a5cea88721bd229,6839c86638a4e862d77f0569,false,false,Fri May 30 2025 15:01:58 GMT+0000 (Coordinated Universal Time),Fri May 30 2025 15:01:58 GMT+0000 (Coordinated Universal Time),Fri May 30 2025 15:01:58 GMT+0000 (Coordinated Universal Time),false,,Mobile SEO: Boost Frictionless Revenue | Magnet,"Transform your mobile SEO strategy to capture 64% of web traffic with faster load times, better rankings, and higher conversions. Expert mobile optimization by Magnet.",Boost your revenue with a frictionless experience,Development - Mobile Optimization - SEO,"<p>Unlike typical agencies that focus on technical fixes, we understand the unique challenges marketing directors face for Mobile SEO, increasing your sales and revenue with ease.</p>",,,"<h2 id="""">Your mobile traffic is leaking revenue</h2><p id="""">Speed kills conversions, not just rankings. While your competitors focus on desktop perfection, 64% of your traffic comes from <a href=""https://explodingtopics.com/blog/mobile-internet-traffic"" id="""">mobile devices</a> that experience a completely different version of your brand.</p>",,"<h3 id=""""><strong id="""">Mobile traffic dominates but most sites don't</strong></h3><p id="""">While 64% of web traffic comes from mobile devices, most sites deliver a compromised experience. Google ranks your site based on mobile performance first—even for desktop searches.</p>",,"<h3 id=""""><strong id="""">Speed equals revenue, not just rankings</strong></h3><p id="""">Sites that load in under 2 seconds see conversion rates <a href=""https://www.portent.com/blog/analytics/research-site-speed-hurting-everyones-revenue.htm"" id="""">2.5x higher</a> than sites loading in 5 seconds. Each second of delay costs you <a href=""https://www.thinkwithgoogle.com/marketing-strategies/app-and-mobile/mobile-page-speed-conversion-data/"" id="""">20% in conversions</a>.</p>",,"<h3 id=""""><strong id="""">Legacy systems bleed mobile revenue daily</strong></h3><p id="""">Marketing directors at mid-market companies face a unique challenge: systems built for desktop-first experiences are costing you mobile customers. The solution isn't just technical—it's strategic.</p>",,"<h2 id="""">Why enterprise brands trust Magnet for mobile optimization</h2><p id="""">Most agencies treat mobile SEO as an afterthought—a responsive design checkbox. Magnet's mobile-first methodology was developed specifically for mid-market companies dealing with legacy systems and complex technical debt. Our data from optimizing countless enterprise mobile experiences shows that strategic mobile optimization delivers 3x higher ROI than generic ""mobile-friendly"" improvements.</p>",,,,,,,,,,,"<h3 id=""""><strong id="""">Discovery &amp; analysis</strong></h3><p id="""">We begin with comprehensive mobile performance auditing, identifying critical issues affecting your mobile rankings and user experience. We map the complete mobile customer journey, identifying friction points that impact conversions.</p>","<h3 id=""""><strong id="""">Strategy &amp; optimization</strong></h3><p id="""">Our team develops a mobile-first content strategy that prioritizes quick access to information. We implement technical optimizations including progressive image loading, mobile-specific schema markup, and accelerated mobile pages.</p>","<h3 id=""""><strong id="""">Implementation &amp; measurement</strong></h3><p id="""">We establish ongoing mobile performance monitoring with real-time alerts for mobile speed or usability issues. Regular mobile user testing validates improvements, while continuous A/B testing refines the mobile experience.</p>",
