Name,Slug,Collection ID,Item ID,Archived,Draft,Created On,Updated On,Published On,Main Nav,Icon,Meta Title,Meta Description,Headline Main,Byline,Excerpt,Featured Image,Image Content Main,Content Main,Image 1,Content 1,Image 2,Content 2,Image 3,Content 3,Image Content Secondary,Content Secondary,Team Members,Areas,Headline 1,Technologies,Articles,Answers,DEP - Resources content,DEP - Headline 2,DEP - Headline 3,DEP - Headline 4,Process Step 1,Process Step 2,Process Step 3,Process Step 4
AI Search Optimization,ai-search-optimization,65c582990a5cea88721bd229,67aedbdd65d369a206b56103,false,false,Fri Feb 14 2025 05:59:57 GMT+0000 (Coordinated Universal Time),Mon May 19 2025 18:38:21 GMT+0000 (Coordinated Universal Time),Mon May 19 2025 18:38:28 GMT+0000 (Coordinated Universal Time),false,https://cdn.prod.website-files.com/6392268cd1a3bc5df594bfa5/65e237416ee7e5acd115a9db_MagicWand.svg,AI Optimization Expertise | Magnet,Transform your digital presence with Magnet's AI optimization services. Our framework ensures visibility across AI platforms while maintaining traditional search performance.,Traditional SEO is no longer enough: future-proof your brand for the AI search revolution,Marketing - SEO - AI Search Engine Optimization,"<p id="""">We've developed a comprehensive framework that ensures your brand appears accurately and favorably in AI-generated responses across all major platforms.</p><p id="""">‍</p>",https://cdn.prod.website-files.com/6392268cd1a3bc5df594bfa5/681e98bde1bf28e2c3dd541b_mike-kononov-lFv0V3_2H6s-unsplash.jpg,,"<h2 id=""""><strong id="""">The New Battle for Visibility Is Being Chosen by AI</strong></h2><p id="""">Forget page-one rankings. In an AI-first world, your content either gets cited—or it gets ignored.</p><p id="""">As search behavior shifts from typed queries to conversational prompts, traditional SEO is no longer your biggest visibility lever. AI engines like ChatGPT, Perplexity, and Google's AI Overviews are rapidly becoming the default interface for information. And they don’t <em id="""">link</em>—they <em id="""">summarize</em>. They <em id="""">reference</em>. They <em id="""">select trusted sources</em>.</p><p id="""">That’s where we come in. At Magnet, we help brands make the leap from optimizing for clicks to optimizing for citations. We engineer your content, structure, and authority to position you as the source AI tools pull from—driving qualified exposure at the exact moment of decision.</p>",https://cdn.prod.website-files.com/6392268cd1a3bc5df594bfa5/681e97ee36db11443eed795a_and-machines-Tl079lLHdk8-unsplash.jpg,"<h4 id=""""><strong id="""">AI Search Is Eating Traditional Traffic</strong></h4><p id="""">By 2026, AI assistants will cut into search volume by at least 25%. If you’re not optimized for AI visibility, you’re playing a shrinking game.</p>",https://cdn.prod.website-files.com/6392268cd1a3bc5df594bfa5/681e97fe56cd9338c5132ee9_getty-images-gH2IjJWktAk-unsplash.jpg,"<h4 id=""""><strong id="""">It’s Not About Ranking—It’s About Recognition</strong></h4><p id="""">AIO isn’t SEO 2.0. It’s a new playing field where structured knowledge, semantic relevance, and brand authority determine who gets mentioned—and who gets left out.</p>",https://cdn.prod.website-files.com/6392268cd1a3bc5df594bfa5/681e98031f6a8e00a4e8dbcb_getty-images-NsUg9nQC0Ck-unsplash.jpg,"<h4 id=""""><strong id="""">Technical Sophistication Wins</strong></h4><p id="""">From schema to knowledge graphs to retrieval-tuned content, we build the backend infrastructure that makes your site intelligible to AI—and irresistible to cite.</p><p id="""">‍</p>",,"<h2 id=""""><strong id="""">We Engineer Brands AI Trusts—and Users Act On</strong></h2><p id="""">AI search rewards clarity, authority, and structured intelligence. Magnet delivers all three.</p><p id="""">Our AIO frameworks combine deep content strategy with advanced technical SEO to transform your site into a citation-ready knowledge source. We tailor every element—language, structure, markup, and metadata—to help AI systems understand you, trust you, and surface your expertise in real-time responses.</p><p id="""">But we don’t stop at visibility. Our goal is business performance. That means higher-quality exposure, richer engagement, and measurable ROI. Whether you’re early in your AIO journey or scaling a multi-platform presence, we bring the expertise and execution to put your brand where the future is already looking.</p>",reisto-belovich; gavin-hall,Marketing,How Magnet can help you master AIO,webflow; wordpress; hubspot; firebase; google-search-console; semrush; ubersuggest,how-to-optimize-your-website-for-both-ai-agents-and-humans-the-new-frontier-of-seo; alexa-bring-me-more-customers-the-ultimate-guide-to-voice-search; beyond-seo-trends-a-technical-guide-to-authentic-digital-authority-in-2025; stop-losing-sales-35-critical-website-fixes-you-can-implement-today,does-magnet-work-with-ai-technologies; what-is-the-difference-between-seo-and-aio; how-quickly-do-i-need-to-implement-aio-strategies; what-technical-elements-are-most-important-for-aio; how-can-i-measure-the-success-of-my-aio-efforts; which-platforms-should-i-focus-on-for-aio; will-aio-replace-traditional-seo; how-is-content-created-for-aio-different-from-traditional-seo-content; what-industries-will-be-most-affected-by-the-shift-to-aio,,How AI-driven search is transforming business visibility,The strategic shift: From keywords to semantic intent,Technical implementation: Making your content AI-ready,"<h3 id=""""><strong id="""">Strategy</strong></h3><p id=""""><strong id=""""><em>AI doesn't search—it selects.</em></strong></p><p id="""">We begin by analyzing your current citation footprint and AI visibility through comprehensive discovery. Our team researches how AI systems currently interpret your content, identifies semantic gaps, and develops a citation-ready knowledge architecture aligned with your business goals. We map your value propositions to the exact queries and AI prompts your audience uses, creating a foundation for AI recognition.</p>","<h3 id=""""><strong id="""">Creative</strong></h3><p id=""""><strong id=""""><em>Structure speaks louder than keywords.</em></strong></p><p id="""">Our specialized team restructures your content to be AI-intelligible, focusing on conversational relevance, structured data points, and authoritative positioning. We craft content that directly addresses user questions while incorporating schema markup, knowledge graphs, and semantic relationships that make your expertise irresistible for AI to reference.</p>","<h3 id=""""><strong id="""">Implementation</strong></h3><p id=""""><strong id=""""><em>Technical excellence makes you technically visible.</em></strong></p><p id="""">Our world-class development team implements the technical infrastructure necessary for AI recognition. This includes advanced schema implementation, retrieval-augmented generation (RAG) optimization, and AI-specific markup that transforms your site into a structured knowledge source. We conduct continuous testing against leading AI platforms to verify citation potential throughout implementation.</p>","<h3 id=""""><strong id="""">Delivery</strong></h3><p id=""""><strong id="""">What gets measured gets cited.</strong></p><p id="""">In the final phase, we deploy proprietary tracking to measure your AI-Generated Visibility Rate, Conversational Engagement, and AI Conversion metrics. We benchmark performance across multiple AI platforms and implement ongoing optimizations to ensure your content remains citation-worthy as algorithms evolve. We provide comprehensive documentation and training so your team understands how to maintain and leverage your new AI visibility advantage.</p>"
Analytics,analytics,65c582990a5cea88721bd229,65c582990a5cea88721bd3ce,false,false,Wed Jun 07 2023 16:58:47 GMT+0000 (Coordinated Universal Time),Tue May 13 2025 18:33:06 GMT+0000 (Coordinated Universal Time),Tue May 13 2025 18:57:14 GMT+0000 (Coordinated Universal Time),true,https://cdn.prod.website-files.com/6392268cd1a3bc5df594bfa5/65e236ee4b16449dd15e116f_analytics.svg,Advanced Analytics for Data-Driven Market Insights | Magnet,"Magnet specializes in analytics to provide deep insights, optimize marketing strategies, enhance operational efficiency, and prepare for future market trends.",Data is the new driver: Transform insights into impactful business decisions,Insights – Strategy – Performance,"<p>Our team specializes in gathering, analyzing, and interpreting data to generate actionable insights, helping clients make informed decisions and optimize their digital strategies effectively.</p>",https://cdn.prod.website-files.com/6392268cd1a3bc5df594bfa5/65566120e14c380d4ac77d29_analytics.jpg,https://cdn.prod.website-files.com/6392268cd1a3bc5df594bfa5/6823905efca3f64d34c28ffb_analytics1.jpg,"<h2 id="""">The new battle for growth is won through data-driven decisions</h2><p id="""">Forget intuition-based strategies. In today's data-rich environment, your business either leverages analytics effectively—or falls behind.</p><p id="""">As markets evolve and competition intensifies, traditional decision-making approaches are no longer sufficient. Modern enterprises harness the power of analytics to uncover hidden opportunities, optimize operations, and drive innovation.</p><p id="""">That's where we come in. At Magnet, we specialize in turning complex data into clear, actionable insights. Our analytics solutions empower you to make informed decisions that align with your strategic objectives and propel your business forward.</p>",,"<h4 id=""""><strong id="""">Data-Driven Strategies Outperform Guesswork</strong></h4><p id="""">By 2026, organizations that effectively utilize analytics will outperform their peers in profitability and efficiency. If you're not leveraging data insights, you're missing out on significant growth opportunities.</p>",,"<h4 id=""""><strong id="""">It's Not Just About Data—It's About Actionable Insights</strong></h4><p id="""">Effective analytics isn't just about collecting data; it's about interpreting it to make informed decisions. We focus on delivering insights that lead to tangible business outcomes.</p>",,"<h4 id=""""><strong id="""">Technical Expertise Enables Strategic Clarity</strong></h4><p id="""">From data integration to advanced modeling, we build analytics frameworks that provide clarity and direction. Our solutions are designed to be scalable, secure, and aligned with your business goals.</p>",https://cdn.prod.website-files.com/6392268cd1a3bc5df594bfa5/68238fabe465814b90c4cd02_analytics2.jpg,"<h2 id="""">We engineer analytics solutions that drive results—and businesses that excel</h2><p id="""">Magnet delivers analytics solutions that are insightful, actionable, and aligned with your objectives.</p><p id=""""><strong id="""">Our approach includes:</strong></p><ul id=""""><li id=""""><strong id="""">Comprehensive Data Integration:</strong> We consolidate data from various sources to provide a unified view of your business.</li><li id=""""><strong id="""">Advanced Analytics Modeling:</strong> Utilizing statistical and machine learning techniques, we uncover patterns and predict trends.</li><li id=""""><strong id="""">Interactive Dashboards:</strong> Our user-friendly dashboards enable stakeholders to explore data and derive insights effortlessly.</li><li id=""""><strong id="""">Continuous Improvement:</strong> We monitor performance and refine models to ensure ongoing relevance and accuracy.</li></ul>",sarah-littlefield; reisto-belovich,Strategy,,google-analytics,,,"<h5 id=""""><a href=""https://www.koganpage.com/"">Understanding Web Analytics and Key Performance Indicators</a> by Damian Ryan</h5><p>This resource provides a comprehensive overview of the fundamentals of web analytics and KPIs, including their importance, how to choose effective ones, and the distinction between KPIs and metrics. It's an essential read for those looking to grasp the basics and complexities of web analytics.</p><h5 id=""""><a href=""https://databox.com/"">Top Website Performance Metrics and KPIs to Track</a></h5><p>An insightful article that discusses critical website performance metrics and KPIs, including dwell time, scroll depth, and pages per session. It offers practical advice on how to measure and interpret these metrics to improve your website's effectiveness.</p><h5 id=""""><a href=""https://www.kaushik.net/"">Web Analytics 101: Definitions: Goals, Metrics, KPIs, Dimensions, Targets</a> by Avinash Kaushik</h5><p>Avinash Kaushik, a leading authority in web analytics, outlines the basics of web analytics, including goals, metrics, KPIs, dimensions, and targets. This blog post is a great starting point for anyone new to web analytics or looking to refresh their knowledge.</p><h5 id=""""><a href=""https://www.woopra.com/"">The 23 Most Important Web Analytics Metrics to Track in 2024</a></h5><p>This article discusses 23 crucial web analytics metrics to track, emphasizing individual customer journey tracking and the significance of understanding traffic sources, landing pages, and page flow to analyze and improve website performance.</p><h5 id=""""><a href=""https://www.hotjar.com/"">A Step-By-Step Guide to Building a Web Analytics Strategy</a></h5><p>A comprehensive guide to developing a web analytics strategy, covering everything from understanding your position within the marketing funnel to determining KPIs, segmenting data for reporting, and analyzing the results to make informed decisions.</p>",,,,,,,
Web Animation,animation,65c582990a5cea88721bd229,65c582990a5cea88721bd462,false,false,Fri Nov 17 2023 17:28:14 GMT+0000 (Coordinated Universal Time),Sun Sep 15 2024 00:59:24 GMT+0000 (Coordinated Universal Time),Tue May 13 2025 13:18:25 GMT+0000 (Coordinated Universal Time),false,https://cdn.prod.website-files.com/6392268cd1a3bc5df594bfa5/65e236f64d4ad2e669dec9a0_SkipForward.svg,Web animation to improve user experience | Magnet,"Magnet enhances website UX with advanced web animation using Three.js, After Effects for engaging, accessible visual narratives.",Motion design to elevate the user experience,Concepts - Motion design - Interactive animation,"<p>At Magnet, we bring digital experiences to life through concept development, motion design, and interactive animation, enhancing user engagement and conveying complex ideas in an intuitive manner.</p>",https://cdn.prod.website-files.com/6392268cd1a3bc5df594bfa5/641d0dcb77be3769373362d5_pq3.jpg,,"<p id="""">At Magnet, we believe that web animation is more than just eye candy – it's a powerful tool for enhancing user experience, communicating brand identity, and driving engagement. As experts in web animation, we specialize in creating immersive and interactive digital experiences that captivate audiences and leave a lasting impression. Let's explore how Magnet's approach to web animation can elevate your website and delight your users.</p><h2 id=""""><strong id="""">Our approach to web animation</strong></h2><p id="""">Web animation is a delicate balance of creativity and technical expertise. At Magnet, we take a holistic approach to web animation, combining artistic flair with technical precision to create animations that not only look stunning but also function seamlessly. Here's how we approach web animation:</p><h3 id=""""><strong id="""">Strategic Planning</strong></h3><p id="""">We begin by understanding your goals, target audience, and brand identity. Whether it's adding subtle micro-interactions to enhance usability or creating bold animations to showcase your brand's personality, we tailor our approach to align with your objectives. Our strategic planning process ensures that every animation serves a purpose and contributes to a cohesive user experience.</p><h3 id=""""><strong id="""">Custom Animation Design</strong></h3><p id="""">Our team of skilled designers and animators works collaboratively to bring your vision to life. From conceptualizing storyboard ideas to refining animation prototypes, we pay attention to every detail to ensure that the final product meets your expectations. Whether it's a simple loading animation or a complex interactive feature, we combine creativity with technical expertise to create animations that resonate with your audience.</p><h3 id=""""><strong id="""">Performance Optimization</strong></h3><p id="""">While animations can enhance user experience, they must not compromise website performance. That's why we prioritize performance optimization in our web animation projects. We use techniques such as lazy loading, image optimization, and code minification to ensure that animations load quickly and smoothly across devices and browsers. Our goal is to create seamless user experiences without sacrificing speed or performance.</p><h3 id=""""><strong id="""">User Testing and Iteration</strong></h3><p id="""">Once animations are implemented, we conduct thorough user testing to gather feedback and identify areas for improvement. We analyze user behavior, gather insights, and iterate on animations based on user feedback. By continuously refining and optimizing animations, we ensure that they enhance user experience and contribute to overall website success.</p><h2 id=""""><strong id="""">Key areas of expertise</strong></h2><p id="""">Our expertise in web animation covers a wide range of areas, including but not limited to:</p><h5 id="""">Micro-Interactions</h5><p id="""">Adding subtle animations to improve usability and provide feedback to users.</p><h5 id="""">Scroll-Based Animations</h5><p id="""">Creating animations triggered by scrolling to guide users through the website and create engaging storytelling experiences.</p><h5 id="""">Interactive Animations</h5><p id="""">Developing interactive elements such as sliders, carousels, and menus that respond to user input and enhance engagement.</p><h5 id="""">Loading Animations</h5><p id="""">Designing loading animations that keep users engaged during page load times and provide visual feedback on progress.</p><h5 id="""">Brand Animation</h5><p id="""">Creating animations that reflect your brand's personality and identity, reinforcing brand recognition and recall.</p><h2 id="""">Why choose Magnet for your web animation project</h2><h5 id="""">Creative Excellence</h5><p id="""">Our team of designers and animators are passionate about pushing the boundaries of creativity and innovation. We pride ourselves on delivering animations that captivate audiences and elevate user experience.</p><h5 id="""">Technical Expertise</h5><p id="""">With years of experience in web development and animation, we have the technical know-how to implement animations seamlessly across platforms and devices.</p><h5 id="""">Collaborative Partnership</h5><p id="""">We view our clients as partners, collaborating closely with them throughout the animation process to ensure that their vision and goals are reflected in the final product.</p><h5 id="""">Results-Oriented</h5><p id="""">Ultimately, our goal is to help you achieve tangible results through web animation. Whether it's increased engagement, higher conversion rates, or improved brand perception, we focus on outcomes that matter to your business.</p>",https://cdn.prod.website-files.com/6392268cd1a3bc5df594bfa5/65566c182e4f0ef45c44a949_software2.jpg,,,,,,,,gavin-hall; george-zhulov; mike-heggie; katie-zeek; irakli-lolashvili,,,figma; next-js; tailwind-css; nuxt-js,,,"<h4 id=""""><strong id="""">Official Documentation and Tutorials</strong></h4><h5 id=""""><a href=""https://gsap.com/docs/v3/"" id=""""><strong id="""">Official GSAP Documentation</strong></a></h5><p id="""">The best place to start for learning GSAP. It provides comprehensive guides, API documentation, and interactive examples to get you up to speed with using GSAP for complex animations.</p><h5 id=""""><a href=""https://gsap.com/community/"" id=""""><strong id="""">GSAP Forums</strong></a></h5><p id="""">An active community forum where users share solutions, ask questions, and showcase their work with GSAP.</p><h5 id=""""><a href=""https://developer.mozilla.org/en-US/docs/Web/CSS/animation"" id=""""><strong id="""">MDN Web Docs (CSS Animations)</strong></a></h5><p id="""">Offers foundational knowledge on using CSS for animations, including keyframes, animation properties, and best practices for smooth, performant animations.</p><h5 id=""""><a href=""https://developer.mozilla.org/en-US/docs/Web/API/Web_Animations_API"" id=""""><strong id="""">MDN Web Docs (Web Animations API)</strong></a></h5><p id="""">An introduction to the Web Animations API, which allows for more control over animations directly from JavaScript, providing a bridge between CSS animations and JavaScript.</p><h4 id=""""><strong id="""">Books on Web Animation</strong></h4><h5 id=""""><a href=""https://www.amazon.com/s?k=SVG+Animations%3A+From+Common+UX+Implementations+to+Complex+Responsive+Animation+by+Sarah+Drasner&crid=G3IE89F2NJTR&sprefix=svg+animations+from+common+ux+implementations+to+complex+responsive+animation+by+sarah+drasner%2Caps%2C164&linkCode=ll2&tag=magnet005-20&linkId=0da587a69363a177996a3cc1571dfc01&language=en_US&ref_=as_li_ss_tl"" id=""""><strong id="""">SVG Animations: From Common UX Implementations to Complex Responsive Animation by Sarah Drasner</strong></a></h5><p id="""">Sarah Drasner, an expert in web animation and a core member of the Vue.js team, guides readers through creating beautiful, responsive animations with SVG. This book includes examples using GSAP for complex animations.</p><h5 id=""""><a href=""https://www.amazon.com/Web-Animation-using-JavaScript-Develop-ebook/dp/B00UNKXVDU?crid=NUSBIJP5QTS2&dib=eyJ2IjoiMSJ9.RCPodwwqSjtIQJh5lSIqiQ.MfngGeBIJErk45qD1uPkZjDLTuzDwdVOM56pVinEAHs&dib_tag=se&keywords=Web+Animation+using+JavaScript%3A+Develop+%26+Design+by+Julian+Shapiro&qid=1708095461&sprefix=animating+with+css+transitions%2C+transforms+and+animation+by+val+head%2Caps%2C212&sr=8-1&linkCode=ll1&tag=magnet005-20&linkId=b4e3cba34c4c27bb2c75941aceaf1272&language=en_US&ref_=as_li_ss_tl"" id=""""><strong id="""">Web Animation using JavaScript: Develop &amp; Design by Julian Shapiro</strong></a></h5><p id="""">Focuses on creating animations with JavaScript, offering insights into performance best practices and techniques for creating smooth animations that enhance user experiences.</p><h5 id=""""><a href=""https://www.youtube.com/c/Ihatetomatoes/videos"" id=""""><strong id="""">Learning GSAP by Petr Tichy</strong></a></h5><p id="""">Although not a traditional book, Petr Tichy's online tutorials and courses are highly regarded within the web development community for learning GSAP. His website offers a range of tutorials from beginner to advanced levels.</p>",,,,,,,
